hate,"Shit shit, i didn't mean to dall asleep again, it's 9am, I wanted to be out by 9.30. Don't know why I'm so tired,I wasn,-20574
sadness,"Spyed Princess Anne today, and listented to all my friends cooking up the perfect evening, Working sucks for me and OB ,-21420
hate,It's car crash tv at it's worst.,-24794
enthusiasm,"bed...sorta. today was good, sara has strep thought Angelina does to; i shared a water with her B4 they told me, i will,-25356
worry,"I don't remember the last movie I saw in the theatre, and that makes me really sad",-26255
sadness,Ok ... the passengers ... no one is alive ... they're all dead ... you just don't know it til the end ... then you cry .,-29468
worry,"Oh hey, look, North Korea are going to kill us all; or at least some of us.",-30723
worry,You people haVe no idea how depressing it is being at a steakhouse and not being able to eat,-31609
