sadness,"I was supported to do things I didn't like,, n when I was about to do what I intrested in,, mom always refused it...",-23
fun,"and she was all like &quot;dude. I care about you.&quot; and it made me smile  yea that teaches me not to drive on E, l,-25
happiness,"omg, the concert was awesome, madrigals gave me chills on almost every piece...brooks also called up alumni, but i didn,-25
sadness,"i get so sucked in to true life, and that steve-o documentary was intense, i love that shit, it's nice to see people ge,-26
worry,"No burgers to be found. New (old) camera to play with though, so that's excellent.",-31
e broke and bleeding, and you know she'll turn her bac,-27
