"I was supported to do things I didn't like,, n when I was about to do what I intrested in,, mom always refused it..."
"and she was all like &quot;dude. I care about you.&quot; and it made me smile  yea that teaches me not to drive on E, l
"I don't remember the last movie I saw in the theatre, and that makes me really sad"
It's a sad day for beer drinking movie goers. The Speakeasy theaters are no more
"I wish she knew what she puts me through..She stole my heart, never gave it back..and occasionally she likes to be like
rt, never gave it back..and occasionally she likes to be like,-27126
 so that's excellent.",-31
e broke and bleeding, and you know she'll turn her bac,-27
