enthusiasm,"bed...sorta. today was good, sara has strep thought Angelina does to; i shared a water with her B4 they told me, i will,-25
relief,"Math was not fun at all. Oh well, i get to cook as soon as i get home.",-27
sadness,"horrible dreams last night  also had one in which i was employed...sigh, if only.",-28
neutral,"If I were an heiress, I would be shopping all day  Kinda bad, I know",-29
worry,"great. my mom is pissed at me, so she sent me to the asbestos filled backroom",-30
 all day, and then sprint through sprinklers without stretching.",-30
o walk all day, and then sprint through sprinklers without stretching.",-30
