hate,"Shit shit, i didn't mean to dall asleep again, it's 9am, I wanted to be out by 9.30. Don't know why I'm so tired,I wasn,-20
worry,"So I played this game , yeahhhhh I lost  I'm inlove ughh....really cause I'm such a fool.",-21
neutral,"i should of gone to kirsty's for the night, anything to get out of the house",-22
neutral,"i really don't want to go to the eisteddfod concert tonight, it would be ok if i didnt have to wear the dumb band unifo,-22
worry,"I don't think Jon and Kate should get a divorce, but I do think if they want to save their marriage they have to quit t,-22
 they want to save their marriage they have to quit t,-22
