neutral,"i really don't want to go to the eisteddfod concert tonight, it would be ok if i didnt have to wear the dumb band unifo,-22840
worry,"I don't think Jon and Kate should get a divorce, but I do think if they want to save their marriage they have to quit t,-22954
sadness,"and I'm so naughty I cant even take my dog, I have to sit &amp; watch how proper dog owners do it, will Brunos life eve,-23263
sadness,"Well thats me for the day, watching Panthers tonight beat the Saints (fingers crossed) cause there are no QLD teams pla,-24009
sadness,"bummed i didnt get to see manchester orchestra bc it was sold out, i spent all night buying tv shows on itunes  lame",-24390
night buying tv shows on itunes  lame",-24
